<?xml version="1.0" encoding="UTF-8"?>
<Mades:cosimulation
    systemName="RC"
    systemPath="zot"
    environmentName="RC"
    environmentPath="modelica"
    environmentFileName="RC.mo"
    xmlns:Mades="http://www.example.org/MadesInput"
    xmlns:xsi="http://www.w3.org/2001/XMLSchema-instance"
    xsi:schemaLocation="http://www.example.org/MadesInput ../../src/mades/cosimulation/MadesInput.xsd ">
  <Mades:variable
    environmentName="COND1"
    scope="environment_shared"
    systemName="COND1"
    type="double"
    value="9.99957504025"
    annotation="default"/>  
  <Mades:variable
    environmentName="s"
    scope="environment_shared"
    systemName="S"
    type="boolean"
    value="1.0"
    annotation="default"/>
  <Mades:variable
    environmentName="REACT1"
    scope="system_shared"
    systemName="REACT1"
    type="double"
    value="0.0"/>
  <Mades:variable
    environmentName="SIGREACT1"
    scope="system_shared"
    systemName="SIGREACT1"
    type="boolean"
    value="0.0"/>
  <Mades:variable
    environmentName="ACT1"
    scope="system_private"
    systemName="ACT1"
    type="boolean"
    />
  <Mades:triggerGroup>
	  <Mades:trigger
	  	scope="environment"
	  	threshold="SOGLIA1"
	  	signal="s"
	  	variable="C1.v"
	  	value="6.0"/>
  </Mades:triggerGroup>
  </Mades:cosimulation>
